{
  "$schema": "./strukt.schema.json",
  "version": 1,
  "style": {
    "direction": "down",
    "colorMode": "outline",
    "styleMode": "plain"
  },
  "nodes": [
    {
      "id": "Web",
      "label": "Editor web",
      "presentation": "card",
      "layoutRole": "entry",
      "icon": "browser",
      "tech": "React · Vite",
      "description": "Canvas, documentos e sketches; browser-preview abre um workspace local sem conta. Métricas opcionais e explícitas dependem da configuração do operador e consentimento do visitante; sem conteúdo dos projetos."
    },
    {
      "id": "Local",
      "label": "API local",
      "presentation": "card",
      "layoutRole": "peer",
      "icon": "terminal",
      "tech": "Hono · Bun",
      "description": "IA, Git, filesystem e integrações locais; self-hosted sem cotas comerciais, com limites técnicos e origem local."
    },
    {
      "id": "Remote",
      "label": "Backend hospedável",
      "presentation": "card",
      "layoutRole": "peer",
      "icon": "server",
      "tech": "Express · Bun",
      "description": "OAuth, contas, workspaces hospedados, convites, MCP remoto e admissão; política self-hosted por padrão ou Cloud escolhida no ambiente confiável."
    },
    {
      "id": "Agents",
      "label": "CLI e MCP",
      "presentation": "card",
      "layoutRole": "entry",
      "icon": "bot",
      "description": "Leitura e escrita de arquitetura, contexto, evidências, importação e validação."
    },
    {
      "id": "Extension",
      "label": "Extensão VS Code",
      "presentation": "card",
      "layoutRole": "entry",
      "icon": "code",
      "description": "Comandos e diagnósticos de diagramas no editor."
    },
    {
      "id": "Domain",
      "label": "Modelo e operações",
      "presentation": "card",
      "layoutRole": "peer",
      "icon": "layers",
      "description": "Core, formatos JSON/DSL, operações validadas, layout e Git."
    },
    {
      "id": "Workspace",
      "label": "Workspace",
      "presentation": "card",
      "layoutRole": "peer",
      "icon": "folder",
      "description": "Manifesto, versões, contexto, evidências e Yjs; política self-hosted separada das cotas da Cloud, isoladas por requisição."
    },
    {
      "id": "Browser",
      "label": "Armazenamento local",
      "presentation": "card",
      "layoutRole": "shared",
      "icon": "hard-drive",
      "tech": "IndexedDB · File System Access",
      "description": "Dados no navegador ou pasta controlada pelo usuário."
    },
    {
      "id": "SQLite",
      "label": "Persistência hospedada",
      "presentation": "card",
      "layoutRole": "shared",
      "icon": "database",
      "tech": "SQLite",
      "description": "Dados e segredos de runtime pertencem ao operador e ficam fora do Git."
    },
    {
      "id": "GitHub",
      "label": "GitHub",
      "presentation": "card",
      "layoutRole": "shared",
      "icon": "github",
      "description": "OAuth e workspace por branch/PR quando um repositório está conectado."
    },
    {
      "id": "AI",
      "label": "Providers de IA",
      "presentation": "card",
      "layoutRole": "shared",
      "icon": "sparkles",
      "description": "BYOK; hosted usa chaves pessoais cifradas e origens públicas permitidas."
    }
  ],
  "connections": [
    {
      "from": "Web",
      "to": "Local",
      "label": "API local opcional"
    },
    {
      "from": "Web",
      "to": "Remote",
      "label": "HTTP e WebSocket"
    },
    {
      "from": "Web",
      "to": "Browser",
      "label": "persistência local"
    },
    {
      "from": "Local",
      "to": "Domain",
      "label": "operações e formatos"
    },
    {
      "from": "Web",
      "to": "Workspace",
      "label": "arquivos e estado"
    },
    {
      "from": "Remote",
      "to": "Workspace",
      "label": "admissão e persistência"
    },
    {
      "from": "Agents",
      "to": "Workspace",
      "label": ".arch e contexto"
    },
    {
      "from": "Extension",
      "to": "Domain",
      "label": "schema e diagnósticos"
    },
    {
      "from": "Workspace",
      "to": "Domain",
      "label": "modelo compartilhado"
    },
    {
      "from": "Remote",
      "to": "SQLite",
      "label": "arquivos, sessões e salas"
    },
    {
      "from": "Remote",
      "to": "GitHub",
      "label": "OAuth e branch/PR"
    },
    {
      "from": "Local",
      "to": "AI",
      "label": "credenciais do operador"
    },
    {
      "from": "Remote",
      "to": "AI",
      "label": "credenciais pessoais"
    },
    {
      "from": "Local",
      "to": "Workspace",
      "label": "pasta local"
    }
  ]
}
