{
  "$schema": "./strukt.schema.json",
  "version": 1,
  "style": {
    "direction": "down",
    "styleMode": "plain"
  },
  "nodes": [
    {
      "id": "Product",
      "label": "Código do produto",
      "presentation": "card",
      "layoutRole": "entry",
      "icon": "code",
      "description": "Produto completo AGPL-3.0-only: editor, servidores, CLI, MCP, extensão, testes e implantação genérica, sem edição proprietária reservada."
    },
    {
      "id": "Operations",
      "label": "Operação privada",
      "presentation": "card",
      "layoutRole": "entry",
      "icon": "lock",
      "description": "Runbooks, decisões comerciais e materiais internos. Não contém credenciais reais nem dados de clientes."
    },
    {
      "id": "Deployment",
      "label": "Runtime do operador",
      "presentation": "card",
      "layoutRole": "peer",
      "icon": "server",
      "description": "Executa a release revisada com domínios e credenciais próprios. O diagrama não comprova uma instalação publicada."
    },
    {
      "id": "Configuration",
      "label": "Configuração e dados privados",
      "presentation": "card",
      "layoutRole": "shared",
      "icon": "database",
      "description": "Variáveis de ambiente, SQLite, backups e logs; ficam fora dos dois repositórios."
    },
    {
      "id": "Checks",
      "label": "Limites de publicação",
      "presentation": "card",
      "layoutRole": "peer",
      "icon": "shield",
      "description": "Git index sem arquivos privados; scan do histórico e checkout, testes e evidências."
    }
  ],
  "connections": [
    {
      "from": "Product",
      "to": "Deployment",
      "label": "build da release"
    },
    {
      "from": "Operations",
      "to": "Deployment",
      "label": "procedimentos e SHA"
    },
    {
      "from": "Configuration",
      "to": "Deployment",
      "label": "somente runtime"
    },
    {
      "from": "Checks",
      "to": "Product",
      "label": "revisão antes da publicação"
    }
  ]
}
